question_id,title,paragraph_id,question,ans_1,ans_2,ans_3,question_id_unique,
278,Intergovernmental_Panel_on_Climate_Change,1,Que veut l'UN pour stabiliser ?,gaz à effet de serre,les concentrations de gaz à effet de serre dans l’atmosphère,stabiliser les concentrations de gaz à effet de serre dans l’atmosphère,57293b843f37b31900478135,
279,Intergovernmental_Panel_on_Climate_Change,1,En quoi consiste le traité de l'UN sur le changement climatique ?,CCNUCC,Convention-cadre des Nations Unies sur changements climatiques (CCNUCC),Convention-cadre des Nations Unies sur changements climatiques (CCNUCC),57293b843f37b31900478136,
280,Intergovernmental_Panel_on_Climate_Change,1,Quelle résolution de l'UN a approuvé le GIEC ?,résolution 43/53,43/53,résolution 43/53,57293b843f37b31900478137,
281,Chloroplast,1,Quel est le rôle principal des chloroplastes ?,photosynthèse,effectuer la photosynthèse,effectuer la photosynthèse,572953013f37b3190047824d,
282,Chloroplast,1,Qu'est-ce que l'ATP conserve ?,énergie,l’énergie,énergie,572953013f37b3190047824e,
283,Chloroplast,1,Que conserve le NADPH ?,énergie,énergie,énergie,572953013f37b3190047824f,
284,Chloroplast,1,Comment s'appelait le processus de transformation du CO2 en molécules organiques ?,le cycle de Calvin,cycle de Calvin,cycle de Calvin,572953013f37b31900478250,
285,Chloroplast,1,Combien de chloroplastes par cellule possèdent les algues ?,1,1,1,572953013f37b31900478251,
286,Prime_number,1,Quel est le seul diviseur autre que 1 qu'un nombre premier peut avoir ?,lui-même,lui-même,lui-même,57296d571d04691400779413,
287,Prime_number,1,Quels sont les nombres supérieurs à 1 qui peuvent être divisés par 3 ou plus de nombres appelés ?,nombre composé.,nombre composé.,nombre composé.,57296d571d04691400779414,
288,Prime_number,1,Quel théorème définit le rôle principal des nombres premiers dans la théorie des nombres ?,Le théorème fondamental de l'arithmétique,fondamental de l'arithmétique,l'arithmétique,57296d571d04691400779415,
289,Prime_number,1,Tout chiffre supérieur à 1 pourra être représenté comme un produit de quoi ?,un produit de nombres premiers,un produit de nombres premiers unique jusqu'à la commande,nombres premiers,57296d571d04691400779416,
290,Prime_number,1,Pourquoi faut-il exclure un afin de préserver le caractère unique du théorème fondamental ?,car on peut inclure arbitrairement de nombreuses instances de 1 dans toute factorisation,on peut inclure arbitrairement de nombreuses instances de 1 dans toute factorisation,on peut inclure arbitrairement de nombreuses instances de 1 dans toute factorisation,57296d571d04691400779417,
291,Rhine,1,Par où commence le Rhine ?,canton suisse,dans le canton suisse des Grisons,canton suisse des Grisons,572f5533a23a5019007fc55b,
292,Rhine,1,Où se vide le Rhine ?,la mer du Nord,la mer du Nord aux Pays-Bas,mer du Nord,572f5533a23a5019007fc55c,
293,Rhine,1,Quelle est la plus grande ville que le Rhine traverse ?,"Cologne, en Allemagne","Cologne, en Allemagne",Cologne,572f5533a23a5019007fc55d,
294,Rhine,1,Quelle rivière est plus large que le Rhine ?,Danube,le Danube,Danube,572f5533a23a5019007fc55e,
295,Rhine,1,Quelle est la longueur du Rhine ?,"1,230 kilomètres","1,230 kilomètres","1,230 kilomètres",572f5533a23a5019007fc55f,
296,Rhine,1,Où est le Rhine ?,européen,Europe centrale et occidentale,Allemagne,572fe1d404bcaa1900d76e37,
297,Rhine,1,Dans quel pays le Rhine se vide ?,Pays-Bas,Allemagne,Pays-Bas,572fe1d404bcaa1900d76e3a,
298,Rhine,1,Combien de kilomètres est le Rhin? ?,"1,230 kilomètres","1,230 kilomètres","1,230",572fe1d404bcaa1900d76e3b,
299,Scottish_Parliament,1,Quand le parlement actuel de l'Écosse a-t-il été convoqué ?,Après un référendum en 1997,1998,1998,572fac17947a6a140053cb54,
300,Scottish_Parliament,1,Quelle loi définit les pouvoirs du Parlement en tant que législature décentralisée ?,Scotland Act 1998,Scotland Act 1998,Scotland Act,572fac17947a6a140053cb55,
301,Scottish_Parliament,1,La compétence législative du Parlement espèce quelles zones ?,dans lesquels il peut légiférer,les domaines dans lesquels il peut légiférer,"pouvoirs « réservés » au Parlement du Royaume-Uni",572fac17947a6a140053cb56,
302,Scottish_Parliament,1,A quel organisme certains pouvoirs sont-ils explicitement spécifiés pour lesquels ils sont réservés ?,Parlement du Royaume-Uni,Parlement du Royaume-Uni,Le Parlement britannique,572fac17947a6a140053cb57,
303,Scottish_Parliament,1,Le Parlement écossais peut légiférer à sa guise tant que les pouvoirs ne sont pas déjà réservés par où ?,Westminster,Westminster,Westminster,572fac17947a6a140053cb58,
304,Islamism,1,Qu'est-ce qu'un mouvement de renaissance islamique ?,L'islamisme,L'islamisme,islamisme,572ff626947a6a140053ce8e,
305,Islamism,1,Quels sont les aspects de la vie dans lesquels l'islamisme cherche à s'intégrer ?,dans tous les domaines,dans tous les domaines,dans tous les domaines,572ff626947a6a140053ce8f,
306,Islamism,1,Quel est le but de l'islamisme quand il s'agit de la société et du gouvernement ?,réorganisation,réorganisation du gouvernement et de la société conformément à la charia,réorganisation,572ff626947a6a140053ce90,
307,Islamism,1,Qu'est-ce que les deux différents mouvements islamistes ont été décrits en oscillant entre les deux ?,pôles,deux pôles,oscillant entre deux pôles,572ff626947a6a140053ce91,
308,Islamism,1,Une stratégie de l'islamisation consiste à s'emparer du pouvoir par quelles méthodes ?,la révolution ou l’invasion,révolution ou l’invasion,révolution,572ff626947a6a140053ce92,
309,Imperialism,1,Le mot impérialisme a ses origines dans quelle langue ancienne ?,latin,latin,latin,573060b48ab72b1400f9c4c6,
310,Imperialism,1,Par quels moyens l'impérialisme étend-il le pouvoir et l'influence d'un pays ?,force militaire,"colonisation, l'utilisation de la force militaire ou d'autres moyens","colonisation, l'utilisation de la force militaire ou d'autres moyens",573060b48ab72b1400f9c4c7,
311,Imperialism,1,"A quel impérialisme de pays de l'Est s'est appliqué ?",japonaise,japonaise,japonaise,573060b48ab72b1400f9c4c9,
312,Imperialism,1,Quel impérialisme s'est répandu ?,technologies et des idées,technologies et des idées,technologies et des idées,573060b48ab72b1400f9c4ca,
313,United_Methodist_Church,1,Que signifie UMC ?,église méthodiste unie,L'église méthodiste unie (UMC),L'église méthodiste unie,5730982f396df919000961e2,
314,United_Methodist_Church,1,"Qu'est-ce que ""United Methodist Church"" ?",méthodiste protestante principale,est une dénomination méthodiste protestante principale,une dénomination méthodiste protestante principale,5730982f396df919000961e3,
315,United_Methodist_Church,1,Quand le UMC a-t-il été fondé ?,1968,1968,1968,5730982f396df919000961e4,
316,United_Methodist_Church,1,Qui a fondé l'UMC ?,l'union de la Methodist Church (États-Unis),John et Charles Wesley en Angleterre,l'union de la Methodist Church (États-Unis) et de la Evangelical United Brethren Church,5730982f396df919000961e5,
317,United_Methodist_Church,1,Quelle est l'orientation théologique de l'église ?,wesleyenne,wesleyenne,wesleyenne,5730982f396df919000961e6,
318,French_and_Indian_War,1,Quand la guerre des Français et des Indiens a eu lieu ?,1754 - 1763,1754 - 1763,1754 - 1763,5733cf61d058e614000b62e9,
319,French_and_Indian_War,1,Qui a combattu dans la guerre de la France et de l'Inde ?,colonies de l’Amérique britannique et de la Nouvelle-France,Amérique britannique et de la Nouvelle-France,l’Amérique britannique et de la Nouvelle-France,5733cf61d058e614000b62ea,
320,French_and_Indian_War,1,Combien y avait-il de personnes dans les colonies françaises de l'Amérique du Nord ?,"environ 60,000 habitants européen","60,000","60,000",5733cf61d058e614000b62eb,
321,French_and_Indian_War,1,Combien de personnes étaient dans les colonies britanniques de l'Amérique du Nord ?,2 millions,2 millions,2 millions,5733cf61d058e614000b62ec,
322,Force,1,Quel concept les philosophes de l'Antiquité utilisaient-ils pour étudier les machines simples ?,force,force,le concept de force,573735e8c3c5551400e51e71,
323,Force,1,Quelle était la croyance que le maintien du mouvement exigeait de la force ?,erreur fondamentale,Une erreur fondamentale,Une erreur fondamentale,573735e8c3c5551400e51e72,
324,Force,1,Qui a eu un aperçu mathématique?,Sir Isaac Newton,Sir Isaac Newton,Sir Isaac Newton,573735e8c3c5551400e51e73,
325,Force,1,Combien de temps a-t-il fallu pour améliorer les lois du mouvement de Sir Isaac Newton ?,près de trois cents ans,trois cents ans,près de trois cents ans,573735e8c3c5551400e51e74,
326,Force,1,Qui a développé la théorie de la relativité?,Einstein,Einstein,Einstein,573735e8c3c5551400e51e75,
