question_id,title,paragraph_id,question,ans_1,ans_2,ans_3,question_id_unique
150,Ctenophora,1,有櫛動物はどこに生息しているか？,海域,世界中の海域,海域,57263eaa38643c19005ad375
151,"Fresno,_California",1,カリフォルニア州で5番目の都市はどの都市か？,Fresno,Fresno,Fresno,5725ce4d38643c19005acd4d
152,"Fresno,_California",1,Fresnoはロサンゼルスからどのくらい遠いか？,200マイル,200マイル（350キロ）,200マイル（350キロ）,5725ce4d38643c19005acd4e
153,"Fresno,_California",1,Fresnoという名前はスペイン語で何を意味しているか？,灰の木,灰の木,灰の木,5725ce4d38643c19005acd4f
154,"Fresno,_California",1,Fresnoの市の旗に掲載されているのは何か？,灰の木の葉,灰の木の葉,木の葉,5725ce4d38643c19005acd50
155,"Fresno,_California",1,Fresnoはどう発音するか？,（/frɛznoʊ/ FREZ-noh）,FREZ-noh,FREZ-noh,5725ce4d38643c19005acd51
156,Packet_switching,1,Paul Baranが発明したのは何か？,Distributed Adaptive Block Switching,Distributed Adaptive Block Switchingの概念,Distributed Adaptive Block Switching,5725d34089a1e219009abf50
157,Packet_switching,1,Distributed Adaptive Block Switchingは何をしたのか？,電気通信メッセージのfault-tolerantで効率的なルーティング方法を供給する,電気通信メッセージのfault-tolerantで効率的なルーティング方法を供給する,電気通信メッセージのfault-tolerantで効率的なルーティング方法,5725d34089a1e219009abf51
158,Packet_switching,1,この概念は何と矛盾したか？,ネットワーク帯域幅の事前割り振りのこれまでに確立された原理と相反し矛盾した,Bell Systemにおける電気通信の発展によって主に強化された、ネットワーク帯域幅の事前割り振りのこれまでに確立された原理,ネットワーク帯域幅の事前割り振りのこれまでに確立された原理,5725d34089a1e219009abf52
159,Packet_switching,1,Donald Daviesは何を信じているのか？,10年後のヨーロッパにおける多数のパケット交換ネットワークを信じている。,modern name packet switchingと、米国の初期ARPANETにおけるコンセプトの導入を含む、10年後のヨーロッパにおける多数のパケット交換ネットワーク,modern name packet switchingと、米国の初期ARPANETにおけるコンセプトの導入を含む、10年後のヨーロッパにおける多数のパケット交換ネットワーク,5725d34089a1e219009abf53
160,Packet_switching,1,1950年代後半にPaul Baranが発明したのは何か？,Distributed Adaptive Block Switchingの概念,Distributed Adaptive Block Switchingの概念,Distributed Adaptive Block Switching,572632ceec44d21400f3dc2f
161,Packet_switching,1,そのシステムの目的は何か？,電気通信メッセージのfault-tolerantで効率的なルーティング方法を供給するという目的,電気通信メッセージのfault-tolerantで効率的なルーティング方法を供給する,電気通信メッセージのfault-tolerantで効率的なルーティング方法を供給する,572632ceec44d21400f3dc30
162,Packet_switching,1,このシステムのmodern nameを信じているのは誰か？,Daviesは、modern name packet switchingと、米国の初期ARPANETにおけるコンセプトの導入を含む、10年後のヨーロッパにおける多数のパケット交換ネットワークを信じている。,Donald Davies,Davies,572632ceec44d21400f3dc31
163,Black_Death,1,黒死病の起源はどこか？,中央アジアの乾燥平原,中央アジア,中央アジア,57264684708984140094c123
164,Black_Death,1,黒死病はどうやって地中海とヨーロッパに運ばれたか？,商業船,商業船,シルクロード,57264684708984140094c124
165,Black_Death,1,ヨーロッパ人口のどのくらいが黒死病に殺されたか？,ヨーロッパの全人口の30から60%,ヨーロッパの全人口の30から60%,30から60%,57264684708984140094c125
166,Black_Death,1,世界人口の水準が黒死病から最終的に回復したのはいつか？,17世紀,17世紀,17世紀,57264684708984140094c126
167,Black_Death,1,その疫病はどのくらいの間留まったのか？,19世紀まで,19世紀まで,19世紀,57264684708984140094c127
168,Geology,1,火成岩は何から結晶化するか？,マグマまたは溶岩,溶融物,溶融物（マグマまたは溶岩）,572657d9dd62a815002e8230
169,Geology,1,堆積岩はどの3種類の岩石になるか？,変成岩,変成岩,変成岩,572657d9dd62a815002e8231
170,Geology,1,3つのタイプの岩石は再溶融されるとき、何が形成されるか？,新たなマグマ,火成岩,新たなマグマ,572657d9dd62a815002e8232
171,Geology,1,3種類の主要な岩石とは何か？,火成岩、堆積岩、変成岩,火成岩、堆積岩、変成岩,火成岩、堆積岩、変成岩の3種類,572657d9dd62a815002e8233
172,Geology,1,岩石のミネラル含有量を変化させるのは何か？,熱と圧力,熱と圧力,熱と圧力,572657d9dd62a815002e8234
173,Newcastle_upon_Tyne,1,NewcastleはEdinburghの南に何マイルにあるか？,103,103マイル,103マイル,5726642f5951b619008f7157
174,Newcastle_upon_Tyne,1,Newcastleは北海の北に何マイルにあるか？,8.5,8.5マイル,8.5マイル,5726642f5951b619008f7158
175,Newcastle_upon_Tyne,1,Newcastleがメンバーとなっているのは何のネットワークか？,Eurocities network,Eurocities network,English Core Cities Group,5726642f5951b619008f7159
176,Newcastle_upon_Tyne,1,1400年までNewcastleはどの郡の一部だったか？,Northumberland,Northumberland,Northumberland郡,5726642f5951b619008f715a
177,Newcastle_upon_Tyne,1,Newcastleとその周辺地域の地域的なニックネームは何か？,Geordie,Geordie,Geordie,5726642f5951b619008f715b
178,Victoria_and_Albert_Museum,1,ヴィクトリア・アンド・アルバート博物館はどこに位置しているか？,V&AはKensington and Chelsea王族行政区にあるBrompton地区に位置,ロンドン,Kensington and Chelsea王族行政区にあるBrompton地区,5726710b708984140094c61d
179,Victoria_and_Albert_Museum,1,何点の永久保存のコレクションが保有されているか？,"4,500,000以上の永久保存のコレクション","4,500,000以上","4,500,000以上",5726710b708984140094c61e
180,Victoria_and_Albert_Museum,1,ヴィクトリア・アンド・アルバート博物館はいつ創設されたか？,それは1852年に創設され,1852,1852,5726710b708984140094c61f
181,Victoria_and_Albert_Museum,1,その美術館の名前が由来するのは誰か？,ヴィクトリア女王とアルバート王子,ヴィクトリア女王とアルバート王子に由来している,ヴィクトリア女王,5726710b708984140094c620
182,Victoria_and_Albert_Museum,1,どの地区にヴィクトリア・アンド・アルバート博物館は位置しているか？,Kensington and Chelsea王族行政区にあるBrompton地区,Kensington and Chelsea王族行政区,Brompton地区,572680ac708984140094c83d
183,Victoria_and_Albert_Museum,1,ヴィクトリア・アンド・アルバート博物館が創建されたのは何年か？,1852,1852,1852,572680ac708984140094c83e
184,Victoria_and_Albert_Museum,1,ヴィクトリア・アンド・アルバート博物館の名前が由来するのはどの君主か？,ヴィクトリア女王とアルバート王子に由来している,ヴィクトリア女王とアルバート王子に由来している,ヴィクトリア女王とアルバート王子,572680ac708984140094c83f
185,Victoria_and_Albert_Museum,1,ヴィクトリア・アンド・アルバート博物館を後援するのはどの省庁か？,デジタル・文化・メディア・スポーツ省,デジタル・文化・メディア・スポーツ省,デジタル・文化・メディア・スポーツ省,572680ac708984140094c840
186,Victoria_and_Albert_Museum,1,その美術館が入館を無料にしたのは何年か？,2001,2001,2001,572680ac708984140094c841
187,American_Broadcasting_Company,1,アメリカン・ブロードキャスティング・カンパニーを所有するのはどの会社か？,ウォルト・ディズニー・カンパニー,ディズニーABCテレビジョングループ,ディズニーABCテレビジョングループ,57267b755951b619008f7433
188,American_Broadcasting_Company,1,アメリカン・ブロードキャスティング・カンパニーがロゴをabcというスタイルにしたのは何年か？,1957,1957,1957,57267b755951b619008f7434
189,American_Broadcasting_Company,1,アメリカン・ブロードキャスティング・カンパニーはニューヨーク市のどの地区に本社があるか？,マンハッタン,マンハッタン,マンハッタン,57267b755951b619008f7435
190,American_Broadcasting_Company,1,アメリカン・ブロードキャスティング・カンパニーの本社はどの通りに位置しているか？,Columbus Avenue and West 66th Street,Columbus Avenue and West 66th Street,Columbus Avenue and West 66th Street,57267b755951b619008f7436
191,American_Broadcasting_Company,1,ディズニーABCテレビジョングループはウォルト・ディズニー・カンパニーのどの部門の子会社か？,メディア・ネットワーク,メディア・ネットワーク,メディア・ネットワーク,57267b755951b619008f7437
192,Genghis_Khan,1,ジンギスカンが創設した帝国は何と呼ばれるか？,モンゴル帝国,モンゴル帝国,モンゴル帝国,57269e8a5951b619008f77f5
193,Genghis_Khan,1,ユーラシアの残りを征服し始める前にジンギスカンが結集したのは誰か？,北東アジアの遊牧民の多く,北東アジアの遊牧民,北東アジアの遊牧民の多く,57269e8a5951b619008f77f6
194,Genghis_Khan,1,特にどの地域で民間人の大量虐殺を行ったか？,KhwarezmianとXiaの征服地域,KhwarezmianとXiaの征服地域,"Qara Khitai, Caucasus, Khwarezmid Empire, Western Xia, Jin王朝",57269e8a5951b619008f77f7
195,Genghis_Khan,1,生涯の終わりまでジンギスカンが占領していたのはどの地域か？,中央アジア及び中国,中央アジア及び中国のかなりの部分,中央アジア及び中国のかなりの部分,57269e8a5951b619008f77f8
196,Genghis_Khan,1,ジンギスカンは他のどの帝国や王朝を征服したか？,"Qara Khitai, Caucasus, Khwarezmid Empire, Western Xia, Jin王朝","Qara Khitai, Caucasus, Khwarezmid Empire, Western Xia, Jin王朝","Qara Khitai, Caucasus, Khwarezmid Empire, Western Xia, Jin王朝",57269e8a5951b619008f77f9
197,Pharmacy,1,薬局という言葉はどの言葉に由来しているか？,pharmaという単語に由来している,pharma,pharma,5726d8bd708984140094d35b
198,Pharmacy,1,pharmaで販売されていたのはどんな商品か？,タバコおよび特許医薬品,タバコおよび特許医薬品,タバコおよび特許医薬品,5726d8bd708984140094d35c
199,Pharmacy,1,ギリシャ語の語源は何を暗示しているか？,魔術や毒薬,魔術や毒薬,魔術,5726d8bd708984140094d35d
200,Pharmacy,1,現代の英語話者はapothecaryという単語をどう捉えるか？,時代遅れか、薬草的療法が大いに提供される場合にのみ適切である,時代遅れ,時代遅れ,5726d8bd708984140094d35e
201,Pharmacy,1,pharmasにより使われたのはその他に何か？,リスト化されていないその他多くの薬草,その他多くの薬草,リスト化されていないその他多くの薬草,5726d8bd708984140094d35f
202,Immune_system,1,免疫系とは何か？,病気から守る生体内の多くの生物学的構造およびプロセスの系,病気から守る生体内の多くの生物学的構造およびプロセスの系,病気から守る生体内の多くの生物学的構造およびプロセスの系,5726e65e708984140094d53d
203,Immune_system,1,免疫系とは何を防御しているか？,ウイルスから寄生虫への病原体として知られている多種多様な動作主体,病気,病気,5726e65e708984140094d53e
204,Immune_system,1,その下位組織のうちの2つは何か？,自然免疫系対適応免疫系、または体液性免疫対細胞性免疫,自然免疫系対適応免疫系、または体液性免疫対細胞性免疫,自然免疫系対適応免疫系、または体液性免疫対細胞性免疫,5726e65e708984140094d53f
205,Immune_system,1,ヒトの脳を保護する部分系は何か？,神経免疫系,神経免疫系,神経免疫系,5726e65e708984140094d540
206,Immune_system,1,免疫系とは何か？,病気から守る生体内の多くの生物学的構造およびプロセス,病気から守る生体内の多くの生物学的構造およびプロセスの系,病気から守る生体内の多くの生物学的構造およびプロセスの系,5726eb76f1498d1400e8efda
207,Immune_system,1,免疫系とは何を防御しているか？,ウイルスから寄生虫への病原体,病気,病気,5726eb76f1498d1400e8efdb
208,Immune_system,1,その下位組織は何か？,体液性免疫対細胞性免疫,自然免疫系対適応免疫系、または体液性免疫対細胞性免疫,自然免疫系対適応免疫系、または体液性免疫対細胞性免疫,5726eb76f1498d1400e8efdc
209,Immune_system,1,免疫系は生体を何から守っているか？,病気,病気,病気,5728eff82ca10214002daadc
210,Immune_system,1,免疫系が検出する動作主体は何として知られているか？,寄生虫への病原体,病原体,病原体,5728eff82ca10214002daadd
211,Immune_system,1,免疫系のどの部分が脳を保護しているか？,神経免疫系,神経免疫,神経免疫,5728eff82ca10214002daade
212,Immune_system,1,末梢免疫系と脳を保護する神経免疫系を分離するのは何か？,血液脳関門、血液脳脊髄液関門および同様の液脳関門,血液脳関門、血液脳脊髄液関門および同様の液脳関門,血液脳関門、血液脳脊髄液関門および同様の液脳関門,5728eff82ca10214002daadf
213,Immune_system,1,免疫系により検出される動作主体は何と呼ばれるか？,寄生虫への病原体,病原体,病原体,572a14af3f37b319004786c1
214,Immune_system,1,免疫系の主要な2つの下位組織は何か？,自然免疫系対適応免疫系、または体液性免疫対細胞性免疫,自然免疫系対適応免疫系、または体液性免疫対細胞性免疫,自然免疫系対適応免疫系、または体液性免疫対細胞性免疫,572a14af3f37b319004786c3
215,Immune_system,1,2種類の免疫力は何か？,自然免疫系対適応免疫系、または体液性免疫対細胞性免疫,自然免疫系対適応免疫系、または体液性免疫対細胞性免疫,自然免疫系対適応免疫系、または体液性免疫対細胞性免疫,572a14af3f37b319004786c2
216,Immune_system,1,脳の免疫系は何として知られているか？,脳を保護する神経免疫系,神経免疫,神経免疫系,572a14af3f37b319004786c4
217,Civil_disobedience,1,不公平な法であると人々が判断したものに対して社会の人々が反乱するときそれは何と呼ばれるか？,不服従,民間の不服従,民間の不服従,57271c235951b619008f860b
218,Civil_disobedience,1,南アフリカの主要な民間の不服従の例は何か？,アパルトヘイト,アパルトヘイト,アパルトヘイトとの戦い,57271c235951b619008f860c
219,Civil_disobedience,1,バルト諸国がソビエト連邦から独立した動きは何と呼ばれるか？,歌唱革命,歌唱革命,歌唱革命,57271c235951b619008f860d
220,Civil_disobedience,1,2004年のオレンジ革命はどの国で発生したか？,ウクライナ,ウクライナ,ウクライナ,57271c235951b619008f860e
221,Civil_disobedience,1,2003年のローズ革命の場所はどこか？,ジョージア州,ジョージア州,ジョージア州,57271c235951b619008f860f
222,Civil_disobedience,1,民間の不服従の最初の例の一つをもたらしたのはどの人々か？,エジプト人,エジプト人,エジプト人,5728d4c03acd2414000dff9f
223,Civil_disobedience,1,民間の服従の最初の例は誰に反対するものであったか？,英国,英国,英国の占領に反対するエジプト人により、1919年の革命においてもたらされた,5728d4c03acd2414000dffa0
224,Civil_disobedience,1,なぜ人々は抵抗するために民間の不服従を選択するのか？,非暴力抵抗,不公平な法であると人々が判断した,非暴力抵抗運動,5728d4c03acd2414000dffa1
225,Civil_disobedience,1,民間の不服従は何に対して抵抗するのか？,不公平な法,不公平な法,不公平な法であると人々が判断したもの,5728d4c03acd2414000dffa2
226,Civil_disobedience,1,アメリカで民間の不服従として知られるのはどの公民権運動か？,アメリカの公民権運動,アメリカの公民権運動,公民権運動,5728d4c03acd2414000dffa3
227,Construction,1,建物やインフラを建造する過程は何か？,建設,建設,建設,57273a465951b619008f86ff
228,Construction,1,典型的には指定された購入者のない類似の品目の大量生産を含むのは何か？,製造,製造,製造,57273a465951b619008f8700
229,Construction,1,建設は国内総生産の何%を構成するか？,6から9%,6から9%,6から9%,57273a465951b619008f8701
230,Construction,1,建設のために必要な3つのものは何か？,計画、設計、資金調達,計画、設計、資金調達,計画、設計、資金調達,57273a465951b619008f8702
231,Construction,1,建築は誰のための場所で構築されるか？,既知のクライアント,クライアント,既知のクライアント,57273a465951b619008f8703
232,Private_school,1,私立学校は民間の学校とともに何と呼ばれるか？,独立学校,独立学校,独立学校,572746addd62a815002e9a5e
233,Private_school,1,スポーツとアートの他にどんな種類の奨学金があるか？,学問,学問,学問,572746addd62a815002e9a5f
234,Private_school,1,強制課税ではなく、私立学校が大きく資金を提供されているのは何か？,授業料,授業料,学生の授業料を請求する,572746addd62a815002e9a60
235,Private_school,1,公立学校が持たない私立学校の権利は何か？,学生を選択する権利,学生を選択する権利,学生を選択する,572746addd62a815002e9a61
236,Harvard_University,1,その学校の名前は誰に由来するか？,John Harvard,John Harvard,John Harvard,5727aa413acd2414000de921
237,Harvard_University,1,学部のプログラムはいつ共学になったか？,1977,1977,1977,5727aa413acd2414000de922
238,Harvard_University,1,大恐慌と第二次世界大戦を通してハーバードの主導者の名前は何か？,James Bryant Conant,James Bryant Conant,James Bryant Conant,5727aa413acd2414000de923
239,Harvard_University,1,1900年にハーバードが創設した組織は何か？,Association of American Universities,Association of American Universities,Association of American Universities,5727aa413acd2414000de924
240,Harvard_University,1,その大学を近代的な研究大学に変えたのはどの大統領か？,Charles W. Eliot,Charles W. Eliot,Charles W. Eliot,5727aa413acd2414000de925
241,"Jacksonville,_Florida",1,人口ではフロリダ州において最大の都市はどこか？,Jacksonville,Jacksonville,Jacksonville,5727c94bff5b5019007d954a
242,"Jacksonville,_Florida",1,Jacksonvilleの2010年における人口は何人か？,"1,345,596","1,345,596","1,345,596",5727c94bff5b5019007d954b
243,"Jacksonville,_Florida",1,Jacksonvilleは米国で何番目に人口が多い都市か？,12番目,12番目,12,5727c94bff5b5019007d954c
244,"Jacksonville,_Florida",1,Jacksonvilleが位置しているのはどの郡か？,Duval,Duval郡,Duval郡,5727c94bff5b5019007d954d
245,"Jacksonville,_Florida",1,Jacksonvilleの市政府が統合したのは何年か？,1869年,1869年,1869,5727c94bff5b5019007d954e
246,Economic_inequality,1,人口の1%は世界の資産の何%を所有していたか？,40%,40%,40%,5727e6cbff5b5019007d97ee
247,Economic_inequality,1,Oxfamの報告によると、世界の富裕層85人は世界人口のどれだけを合わせたのと等しい富を持つか？,世界人口の下位50% 、つまり約35億人,世界人口の下位50%,50%,5727e6cbff5b5019007d97ef
248,Economic_inequality,1,上位1%となるために、人はどの程度資産を保有する必要があるか？,"759,900ドル","759,900ドル","759,900ドル",5727e6cbff5b5019007d97f0
249,Economic_inequality,1,Oxfamの主張に対して、何に基づいて疑問が呈されたか？,使用された方法論,使用された方法論,「馬鹿げた議論」,5727e6cbff5b5019007d97f1
250,Economic_inequality,1,Oxfamの報告書はなぜ疑問のある結果とされたか？,使用された方法論,馬鹿げた議論,アメリカや西ヨーロッパには中国よりも貧しい人々が多い,5727e6cbff5b5019007d97f2
251,Economic_inequality,1,2000年には人口のたった1%が世界の資産の何%を所有していたか？,40%,40%,40%,5729d36b1d04691400779607
252,Economic_inequality,1,世界で最も富裕な3人は何を最低48か国を合わせたものより多く保有しているか？,最低48カ国を合わせたものよりも多くの金融資産,金融資産,最低48カ国を合わせたものよりも多くの金融資産,5729d36b1d04691400779608
253,Economic_inequality,1,2008年に「1000万ドルの億万長者」の富を合わせたものはいくらであったか？,ほぼ41兆ドル,ほぼ41兆ドル,41兆ドル,5729d36b1d04691400779609
254,Economic_inequality,1,2016年までに富裕層1%は世界の富のどのくらいを所有すると報告されたか？,世界の富の半分以上,半分以上,2016年までに世界の富の半分以上を所有する,5729d36b1d0469140077960a
255,Economic_inequality,1,なぜアメリカや西ヨーロッパには中国よりも貧しい人々が多いのか？,債務を負担する傾向が強いため,債務を負担する傾向が強いため,純財産（資産を積み重ね、債務を減じる）に基づいてアメリカや西ヨーロッパには中国よりも貧しい人々が多い （債務を負担する傾向が強いため）,5729d36b1d0469140077960b
256,Doctor_Who,1,Doctor Whoを制作したのは誰か？,BBC,BBC,BBC,5727efabff5b5019007d98e2
257,Doctor_Who,1,Doctor Whoが初めてテレビで放映されたのはいつか？,1963,1963年,1963年,5727efabff5b5019007d98e3
258,Doctor_Who,1,Doctor Whoの宇宙船は何と呼ばれるか？,TARDIS,TARDIS,TARDIS,5727efabff5b5019007d98e4
259,Doctor_Who,1,TARDISはどのような外装であったか？,青い英国の交番,英国の交番,青い英国の交番,5727efabff5b5019007d98e5
260,Doctor_Who,1,Doctor Whoはどのようなジャンルのテレビ番組であったか？,SF (science fiction）,science fiction,SF,5727efabff5b5019007d98e6
261,University_of_Chicago,1,シカゴ大学はどんな大学か？,私立研究大学,私立研究大学,シカゴにある私立研究大学,57283c464b864d19001647c8
262,University_of_Chicago,1,シカゴ大学はいつ設立されたか？,1890年,1890,1890,57283c464b864d19001647c9
263,University_of_Chicago,1,シカ大学にはいくつの職業学校があるか？,7つの職業学校,7つ,7つ,57283c464b864d19001647ca
264,University_of_Chicago,1,シカゴ大学はいくつの学術研究部門を持つか？,4つ,4つ,4つ,57283c464b864d19001647cb
265,University_of_Chicago,1,シカゴ大学は全体で何人の学生が入学しているか？,"約5,000人","約15,000人","5,000",57283c464b864d19001647cc
266,Yuan_dynasty,1,the Yuan dynastyの中国語の名前は何か？,Yuán Cháo,Yuán Cháo,元朝,57285ed5ff5b5019007da1b6
267,Yuan_dynasty,1,the Yuan dynastyの正式名称は何か？,the Great Yuan,the Great Yuan,the Great Yuan,57285ed5ff5b5019007da1b7
268,Yuan_dynasty,1,the Yuan dynastyを設立したのは誰か？,Kublai Khan,Kublai Khan,Kublai Khan,57285ed5ff5b5019007da1b8
269,Yuan_dynasty,1,モンゴルのBorjigin族のリーダーは誰か？,Kublai Khan,Kublai Khan,Kublai Khan,57285ed5ff5b5019007da1b9
270,Yuan_dynasty,1,Kublai Khanが正式に中国の伝統的な形式で王朝を宣言したのはいつか？,1271,1271,1271,57285ed5ff5b5019007da1ba
271,Kenya,1,ケニアはどこに位置しているか？,アフリカ,アフリカ,アフリカ,5728dab94b864d1900164f96
272,Kenya,1,ケニアは何の創設メンバーか？,the East African Community (EAC),East African Community,EAC,5728dab94b864d1900164f97
273,Kenya,1,ケニアの首都はどこか？,ナイロビ,ナイロビ,ナイロビ,5728dab94b864d1900164f98
274,Kenya,1,ケニアが南に面しているのはどこか？,タンザニア,タンザニア,タンザニア,5728dab94b864d1900164f99
275,Kenya,1,2014年6月時点でどのくらいの人口を有しているか？,"約4,500万人","4,500万人","約4,500万人",5728dab94b864d1900164f9a
276,Intergovernmental_Panel_on_Climate_Change,1,IPCCはどの国際機関の一部か？,国連,国連,国連,57293b843f37b31900478133
277,Intergovernmental_Panel_on_Climate_Change,1,IPCCを設立したのは2つの国連機関どれか？,the World Meteorological Organization (WMO) と the United Nations Environment Programme (UNEP),the World Meteorological Organization (WMO) と the United Nations Environment Programme (UNEP),the World Meteorological Organization (WMO) と the United Nations Environment Programme (UNEP),57293b843f37b31900478134
