question_id,title,paragraph_id,question,ans_1,ans_2,ans_3,question_id_unique
278,Intergovernmental_Panel_on_Climate_Change,1,UNFCCCが安定させようとしているのは何か？,大気中の温室効果ガス濃度,温室効果ガス濃度,人為的な（すなわち人間による）危険な気候システムへの干渉を防止するレベルで、大気中の温室効果ガス濃度を安定させる,57293b843f37b31900478135
279,Intergovernmental_Panel_on_Climate_Change,1,気候変動に関する主要な国際条約は何か？,the United Nations Framework Convention on Climate Change (UNFCCC),the United Nations Framework Convention on Climate Change (UNFCCC),UNFCCC,57293b843f37b31900478136
280,Intergovernmental_Panel_on_Climate_Change,1,IPCCを承認した国連総会の決議はいくつか？,決議 43/53により国連総会で承認された,43/53,決議 43/53により国連総会で承認,57293b843f37b31900478137
281,Chloroplast,1,葉緑体の主要な役割は何か？,太陽光からエネルギーを取り込んでそれを変換し、エネルギー蓄積分子ATPおよびNADPHに貯蔵し、酸素を水から解放する光合成を行うこと,酸素を水から解放する光合成を行う,光合成,572953013f37b3190047824d
282,Chloroplast,1,ATPは何を貯蔵するか？,エネルギー,エネルギー,エネルギー,572953013f37b3190047824e
283,Chloroplast,1,NADPHは何を貯蔵するか？,エネルギー,エネルギー,エネルギー,572953013f37b3190047824f
284,Chloroplast,1,二酸化炭素から有機分子を作るためのプロセスは何として知られるか？,カルビン回路,カルビン回路,カルビン回路,572953013f37b31900478250
285,Chloroplast,1,1細胞あたりの葉緑体の数はいくつか？,1,100,1から100,572953013f37b31900478251
286,Prime_number,1,素数の1以外の除数は何か？,それ自身,それ自身,それ自身,57296d571d04691400779413
287,Prime_number,1,素数でない1より大きい自然数は何と呼ばれるか？,合成数,合成数,合成数,57296d571d04691400779414
288,Prime_number,1,数論における素数の中心的役割を確立するのは何の定理か？,算術の基本定理,算術の基本定理,算術の基本定理,57296d571d04691400779415
289,Prime_number,1,1より大きい任意の整数は何として表すことができるか？,素数の積,素数の積,素数の積,57296d571d04691400779416
290,Prime_number,1,なぜ1を素数として除外する必要があるのか？,定理の一意性は、1は任意の因数分解において任意の1を含むことができることで保証されるので,1は任意の因数分解において任意の1を含むことができる,定理の一意性は、1は任意の因数分解において任意の1を含むことができることで保証されるので,57296d571d04691400779417
291,Rhine,1,ライン川はどこで始まるのか？,スイスアルプス南東部のGraubündenのSwiss canton,Swiss canton,Graubünden,572f5533a23a5019007fc55b
292,Rhine,1,ライン川が通ってないのはどこか？,オランダ,オランダ,オランダ,572f5533a23a5019007fc55c
293,Rhine,1,ライン川の流域で最大の都市はどこか？,ドイツのCologne,Cologne,Cologne,572f5533a23a5019007fc55d
294,Rhine,1,ライン川より大きいのは中部及び西ヨーロッパのどの川か？,ドナウ川,ドナウ川,ドナウ川,572f5533a23a5019007fc55e
295,Rhine,1,ライン川のどのくらいの長さがあるか？,"約1,230キロメートル (760マイル)","1,230キロメートル",760マイル,572f5533a23a5019007fc55f
296,Rhine,1,ライン川はどこにあるか？,ヨーロッパ,中部及び西ヨーロッパ,中部及び西ヨーロッパ,572fe1d404bcaa1900d76e37
297,Rhine,1,ライン川が通ってないのはどの国か？,ドイツ,オランダ,オランダ,572fe1d404bcaa1900d76e3a
298,Rhine,1,ライン川は何キローメートルか？,"約1,230キロメートル","1,230キロメートル","1,230キロメートル",572fe1d404bcaa1900d76e3b
299,Scottish_Parliament,1,現在のスコットランド議会はいつ召集されたか？,1997,1998,1998,572fac17947a6a140053cb54
300,Scottish_Parliament,1,現在のスコットランド議会に譲渡された立法機関としての権力を与えたのは何か？,1998年のスコットランド法,スコットランド法,1998年のスコットランド法,572fac17947a6a140053cb55
301,Scottish_Parliament,1,スコットランド議会が立法権を有しているのはどの分野か？,Westminsterに明示的に留保されていない全ての分野,Westminsterに明示的に留保されていない全ての分野,Westminsterに明示的に留保されていない全ての分野,572fac17947a6a140053cb56
302,Scottish_Parliament,1,スコットランド議会の任期を変更する権限を保持し、法律を制定できる分野を拡大または縮小できるのはどこか？,Westminster,英国議会,英国議会,572fac17947a6a140053cb57
303,Scottish_Parliament,1,スコットランド議会はその立法権がどこに保有されていると明示的に留保されていない分野において立法権を持つか？,Westminster,Westminster,Westminster,572fac17947a6a140053cb58
304,Islamism,1,イスラム復興運動は何か？,政治イスラム教として知られているイスラム主義,イスラム主義,政治イスラム教,572ff626947a6a140053ce8e
305,Islamism,1,イスラム主義がイスラムの価値を実装すると試みているのは生活のどの領域か？,生活のあらゆる領域,生活のあらゆる領域,あらゆる領域,572ff626947a6a140053ce8f
306,Islamism,1,政府と社会に関してイスラム主義は何を好むか？,政府と社会の順序を変える (reordering）,reordering,Shari'aに従い、政府と社会の順序を変える (reordering）ことを好む,572ff626947a6a140053ce90
307,Islamism,1,異なるイスラム主義者の動きは何の間の振動として描写されてきたか？,2つの極,極,2つの極の間,572ff626947a6a140053ce91
308,Islamism,1,社会イスラム化戦略は何によって国家権力を掌握するか？,革命や侵略,革命や侵略,革命,572ff626947a6a140053ce92
309,Imperialism,1,帝国主義は何語の単語に由来するか？,ラテン語,ラテン,ラテン語,573060b48ab72b1400f9c4c6
310,Imperialism,1,帝国主義は何を通じて国の権力と影響力を拡大するか？,植民地化、軍事力やそのほかの手段の利用,軍事力,植民地化,573060b48ab72b1400f9c4c7
311,Imperialism,1,帝国主義という単語は西洋の以外ではどの国に適用されたか？,日本,日本,日本,573060b48ab72b1400f9c4c9
312,Imperialism,1,帝国主義は何が急速に広がることも許してきたか？,技術やアイディア,技術やアイディア,技術やアイディア,573060b48ab72b1400f9c4ca
313,United_Methodist_Church,1,UMCは何を表しているか？,合同メソジスト教会,合同メソジスト教会,合同メソジスト教会,5730982f396df919000961e2
314,United_Methodist_Church,1,合同メソジスト教会とは何か？,主流のプロテスタントのメソジスト宗派,主流のプロテスタントのメソジスト宗派,主流のプロテスタントのメソジスト宗派,5730982f396df919000961e3
315,United_Methodist_Church,1,合同メソジスト教会はいつ設立されたか？,1968年,1968,1968年,5730982f396df919000961e4
316,United_Methodist_Church,1,誰がUMCを設立したか？,the union of the Methodist Church（USA）とthe Evangelical United Brethren Churchの連合,the union of the Methodist Church（USA）とthe Evangelical United Brethren Churchの連合,the union of the Methodist Church（USA）とthe Evangelical United Brethren Church,5730982f396df919000961e5
317,United_Methodist_Church,1,その協会の神学的な起源は何にあるか？,Wesleyan,Wesleyan,Wesleyan,5730982f396df919000961e6
318,French_and_Indian_War,1,フレンチ・インディアン戦争はいつか？,1754–1763,1754–1763,1754–1763,5733cf61d058e614000b62e9
319,French_and_Indian_War,1,フレンチ・インディアン戦争で戦ったのは誰か？,British AmericaとNew Franceの植民地,British AmericaとNew Franceの植民地,British AmericaとNew Franceの植民地,5733cf61d058e614000b62ea
320,French_and_Indian_War,1,フランスの北米植民地には何人の人々がいたか？,"約60,000人のヨーロッパ人の定住者","約60,000人","60,000",5733cf61d058e614000b62eb
321,French_and_Indian_War,1,イギリスの北米植民地には何人の人々がいたか？,200万人,200万人,200万,5733cf61d058e614000b62ec
322,Force,1,古代の哲学者が単純な機械の研究において用いたのは何の概念か？,力,力,力,573735e8c3c5551400e51e71
323,Force,1,力とは一定速度の動により保持されるものであるという信念は何であったか？,根本的な誤り,根本的な誤り,根本的な誤り,573735e8c3c5551400e51e72
324,Force,1,数学的な視点に基づいて運動法則を定式化したのは誰か？,Sir Isaac Newton,Sir Isaac Newton,Sir Isaac Newton,573735e8c3c5551400e51e73
325,Force,1,どれくらいの期間、Sir Isaac Newtonの運動法則は改良されていないか？,300年,300年近く,300年近く,573735e8c3c5551400e51e74
326,Force,1,相対性理論を開発したのは誰か？,Einstein,Einstein,Einstein,573735e8c3c5551400e51e75
